root@ubuntu:/home/biao/C/USB/usb_test_class# lsusb -t
/:  Bus 02.Port 1: Dev 1, Class=root_hub, Driver=xhci_hcd/4p, 5000M
/:  Bus 01.Port 1: Dev 1, Class=root_hub, Driver=xhci_hcd/11p, 480M
    |__ Port 2: Dev 7, If 0, Class=Vendor Specific Class, Driver=, 480M
    |__ Port 2: Dev 7, If 1, Class=Vendor Specific Class, Driver=, 480M
    |__ Port 2: Dev 7, If 2, Class=Vendor Specific Class, Driver=, 480M
    |__ Port 2: Dev 7, If 3, Class=Vendor Specific Class, Driver=, 480M
    |__ Port 2: Dev 7, If 4, Class=Communications, Driver=usb_test, 480M
    |__ Port 2: Dev 7, If 5, Class=CDC Data, Driver=, 480M

T:  Bus=01 Lev=01 Prnt=01 Port=01 Cnt=01 Dev#=  7 Spd=480  MxCh= 0
D:  Ver= 2.00 Cls=ef(misc ) Sub=02 Prot=01 MxPS=64 #Cfgs=  1
P:  Vendor=2c7c ProdID=0125 Rev= 3.18
S:  Manufacturer=Android
S:  Product=Android
C:* #Ifs= 6 Cfg#= 1 Atr=a0 MxPwr=500mA
A:  FirstIf#= 4 IfCount= 2 Cls=02(comm.) Sub=0e Prot=00
I:* If#= 0 Alt= 0 #EPs= 2 Cls=ff(vend.) Sub=ff Prot=ff Driver=(none)
E:  Ad=81(I) Atr=02(Bulk) MxPS= 512 Ivl=0ms
E:  Ad=01(O) Atr=02(Bulk) MxPS= 512 Ivl=0ms
I:* If#= 1 Alt= 0 #EPs= 3 Cls=ff(vend.) Sub=00 Prot=00 Driver=(none)
E:  Ad=83(I) Atr=03(Int.) MxPS=  10 Ivl=32ms
E:  Ad=82(I) Atr=02(Bulk) MxPS= 512 Ivl=0ms
E:  Ad=02(O) Atr=02(Bulk) MxPS= 512 Ivl=0ms
I:* If#= 2 Alt= 0 #EPs= 3 Cls=ff(vend.) Sub=00 Prot=00 Driver=(none)
E:  Ad=85(I) Atr=03(Int.) MxPS=  10 Ivl=32ms
E:  Ad=84(I) Atr=02(Bulk) MxPS= 512 Ivl=0ms
E:  Ad=03(O) Atr=02(Bulk) MxPS= 512 Ivl=0ms
I:* If#= 3 Alt= 0 #EPs= 3 Cls=ff(vend.) Sub=00 Prot=00 Driver=(none)
E:  Ad=87(I) Atr=03(Int.) MxPS=  10 Ivl=32ms
E:  Ad=86(I) Atr=02(Bulk) MxPS= 512 Ivl=0ms
E:  Ad=04(O) Atr=02(Bulk) MxPS= 512 Ivl=0ms
I:* If#= 4 Alt= 0 #EPs= 1 Cls=02(comm.) Sub=0e Prot=00 Driver=usb_test
E:  Ad=89(I) Atr=03(Int.) MxPS=  64 Ivl=32ms
I:* If#= 5 Alt= 0 #EPs= 0 Cls=0a(data ) Sub=00 Prot=02 Driver=(none)
I:  If#= 5 Alt= 1 #EPs= 2 Cls=0a(data ) Sub=00 Prot=02 Driver=(none)
E:  Ad=88(I) Atr=02(Bulk) MxPS= 512 Ivl=0ms
E:  Ad=05(O) Atr=02(Bulk) MxPS= 512 Ivl=0ms

[174759.070129] [usb_test_probe] 0x2, 0xe,0x0

